{
  "type": "dd::mono_config@1.0.0",
  "name": "test_mono",
  "dvrk_console_namespace": "console",
  "sinks": [
    "glimage"
  ],
  "unixfdsinks": [
    {
      "stream": "overlay"
    }
  ],
  "camera": {
    "stream": "videotestsrc pattern=ball is-live=true ! video/x-raw,width=640,height=480,framerate=30/1",
    "size": {
      "width": 640,
      "height": 480
    }
  }
}
